{
  "schema_version": "executive-career-dossier-v1",
  "dossier_kind": "linkedin_profile_diagnostic",
  "locale": "es",
  "evidence_as_of": "2026-08-07",
  "case_scope": "single_candidate",
  "benchmarking": "disabled",
  "requested_technology_terms": [],
  "focus": {"statement": "Objetivo bajo revisión: aclarar una propuesta profesional con evidencia disponible.", "state": "target_under_review", "claim_ids": []},
  "evidence_scope": {
    "inspection_mode": "provided_material",
    "captured_as_of": "2026-08-07",
    "inspected_sections": ["headline", "about", "experience", "skills", "proof", "completeness", "photo", "banner"],
    "unavailable_sections": [],
    "confidence": "high",
    "visual_state": "authorized_visual_visible",
    "visual_capture_ref": "CAP-001"
  },
  "evidence": [
    {"id": "E-001", "state": "verified", "section": "headline", "source_kind": "provided_material", "paraphrase": "El titular comunica un enfoque profesional general.", "capture_ref": null},
    {"id": "E-002", "state": "verified", "section": "about", "source_kind": "provided_material", "paraphrase": "La apertura describe responsabilidades de forma amplia.", "capture_ref": null},
    {"id": "E-003", "state": "candidate_reported", "section": "experience", "source_kind": "candidate_statement", "paraphrase": "Se reporta experiencia aplicable que requiere confirmación de alcance.", "capture_ref": null},
    {"id": "E-004", "state": "candidate_reported", "section": "skills", "source_kind": "candidate_statement", "paraphrase": "Se reportan habilidades que requieren un ejemplo verificable.", "capture_ref": null},
    {"id": "E-005", "state": "verified", "section": "completeness", "source_kind": "provided_material", "paraphrase": "Las secciones básicas están presentes.", "capture_ref": null},
    {"id": "E-006", "state": "verified", "section": "photo", "source_kind": "authorized_visible", "paraphrase": "La foto es visible para revisión de presentación.", "capture_ref": "CAP-001"},
    {"id": "E-007", "state": "verified", "section": "banner", "source_kind": "authorized_visible", "paraphrase": "El banner es visible para revisión de presentación.", "capture_ref": "CAP-001"}
  ],
  "claims": [
    {"id": "C-001", "state": "verified", "paraphrase": "Existe una base para una propuesta profesional concreta.", "evidence_ids": ["E-001", "E-002"], "public_use": "allowed"},
    {"id": "C-002", "state": "candidate_reported", "paraphrase": "Un ejemplo de habilidades puede incluirse tras confirmar su alcance.", "evidence_ids": ["E-004"], "public_use": "confirmation_required"}
  ],
  "verdict": {"statement": "La propuesta puede ser más concreta.", "rationale": "La evidencia disponible permite priorizar claridad y prueba.", "start_here_action": "Revisa un borrador privado del titular antes de cualquier cambio del perfil.", "evidence_state": "verified", "evidence_ids": ["E-001", "E-002"]},
  "coverage": {"evaluated_count": 6, "scored_weight": 90, "not_scored_weight": 10, "overall_score": 71, "confidence": "high"},
  "priorities": [
    {"rank": 1, "title": "Aclarar el titular", "problem": "El enfoque profesional sigue siendo amplio.", "why_now": "La primera lectura necesita una señal concreta.", "action": "Redacta y revisa en privado una versión más específica del titular.", "timebox_minutes": 25, "done_when": "Existe un borrador que expresa el enfoque sin añadir hechos nuevos.", "evidence_state": "verified", "evidence_ids": ["E-001"], "dimensions": ["headline"]},
    {"rank": 2, "title": "Ordenar la apertura", "problem": "La apertura no separa el foco de la evidencia.", "why_now": "Una introducción clara facilita una lectura rápida.", "action": "Compara dos aperturas privadas usando solo evidencia disponible.", "timebox_minutes": 30, "done_when": "Una apertura elegida conserva el límite de evidencia.", "evidence_state": "verified", "evidence_ids": ["E-002"], "dimensions": ["about"]},
    {"rank": 3, "title": "Confirmar una prueba", "problem": "Una habilidad reportada necesita contexto.", "why_now": "El ejemplo cambia qué copia puede usarse.", "action": "Confirma en privado un ejemplo y su alcance antes de usarlo en copia.", "timebox_minutes": 20, "done_when": "La respuesta permite aprobar u omitir el ejemplo.", "evidence_state": "candidate_reported", "evidence_ids": ["E-004"], "dimensions": ["skills", "proof"]}
  ],
  "recruiter_scan": {
    "understood_signal": {"statement": "Se entiende una orientación profesional general.", "evidence_state": "verified", "evidence_ids": ["E-001"]},
    "ambiguity": {"statement": "Falta una prueba breve que precise el alcance.", "evidence_state": "candidate_reported", "evidence_ids": ["E-004"]},
    "positioning_bridge": {"statement": "Explica el foco con un ejemplo confirmado cuando sea apropiado.", "evidence_state": "verified", "evidence_ids": ["E-001", "E-002"]}
  },
  "dimensions": [
    {"dimension": "visual", "state": "evaluated", "score": 74, "reason": "Hay evidencia visible autorizada para ambos elementos.", "evidence_state": "verified", "evidence_ids": ["E-006", "E-007"], "capture_ref": "CAP-001"},
    {"dimension": "headline", "state": "evaluated", "score": 68, "reason": "El enfoque puede expresarse con mayor precisión.", "evidence_state": "verified", "evidence_ids": ["E-001"], "capture_ref": null},
    {"dimension": "about", "state": "evaluated", "score": 70, "reason": "La apertura puede ordenar la propuesta y la prueba.", "evidence_state": "verified", "evidence_ids": ["E-002"], "capture_ref": null},
    {"dimension": "experience", "state": "evaluated", "score": 72, "reason": "La estructura permite una mejora de claridad.", "evidence_state": "candidate_reported", "evidence_ids": ["E-003"], "capture_ref": null},
    {"dimension": "skills", "state": "evaluated", "score": 65, "reason": "Una habilidad requiere confirmación de alcance.", "evidence_state": "candidate_reported", "evidence_ids": ["E-004"], "capture_ref": null},
    {"dimension": "proof", "state": "not_evaluated", "score": null, "reason": "No hay prueba suficiente para puntuar esta dimensión.", "evidence_state": "unknown", "evidence_ids": [], "capture_ref": null},
    {"dimension": "completeness", "state": "evaluated", "score": 80, "reason": "Las secciones básicas están presentes.", "evidence_state": "verified", "evidence_ids": ["E-005"], "capture_ref": null}
  ],
  "visual_review": {"photo": {"state": "evaluated", "finding": "La presentación es visible para una revisión limitada.", "private_action": "Revisa en privado si la imagen sigue representando el enfoque actual.", "evidence_state": "verified", "evidence_ids": ["E-006"], "capture_ref": "CAP-001", "score": 76}, "banner": {"state": "evaluated", "finding": "La presentación es visible para una revisión limitada.", "private_action": "Revisa en privado si el banner apoya el enfoque actual.", "evidence_state": "verified", "evidence_ids": ["E-007"], "capture_ref": "CAP-001", "score": 71}},
  "copy_blocks": [
    {"category": "headline", "state": "ready", "copy": "Enfoque profesional claro con evidencia disponible", "why_it_works": "Hace explícito el foco sin añadir un resultado.", "claim_ids": ["C-001"], "evidence_ids": ["E-001", "E-002"], "claim_boundary": "Usa solo evidencia disponible.", "evidence_state": "verified", "question_rank": null},
    {"category": "about_opening", "state": "requires_confirmation", "copy": "Aporto un enfoque claro respaldado por un ejemplo confirmado.", "why_it_works": "Reserva el ejemplo hasta confirmar su alcance.", "claim_ids": ["C-002"], "evidence_ids": ["E-004"], "claim_boundary": "Confirma el alcance antes de usar el ejemplo.", "evidence_state": "candidate_reported", "question_rank": 1},
    {"category": "experience_bullet", "state": "ready", "copy": "Organicé una experiencia disponible alrededor de un foco profesional claro.", "why_it_works": "Convierte evidencia conocida en una descripción prudente.", "claim_ids": ["C-001"], "evidence_ids": ["E-003"], "claim_boundary": "No añade alcance ni resultado no confirmado.", "evidence_state": "candidate_reported", "question_rank": null}
  ],
  "do_not_change": [{"claim_ids": ["C-002"], "reason": "No uses el ejemplo hasta confirmar su alcance.", "evidence_state": "candidate_reported", "evidence_ids": ["E-004"]}],
  "screen_bridge": {"state": "ready", "copy": "Mi perfil presenta un foco profesional claro y puedo ampliar con evidencia confirmada.", "why_it_works": "Mantiene la conversación dentro de la evidencia disponible.", "claim_ids": ["C-001"], "evidence_ids": ["E-001", "E-002"], "claim_boundary": "No afirma una entrevista ni un resultado.", "evidence_state": "verified", "question_rank": null},
  "questions": [{"rank": 1, "question": "¿Qué ejemplo confirmado describe mejor el alcance de la habilidad reportada?", "changes": "Cambia la copia de apertura.", "linked_copy_category": "about_opening", "evidence_ids": ["E-004"]}],
  "seven_day_plan": [{"day": 1, "category": "review_copy", "action": "Revisa el borrador del titular en privado.", "done_when": "El borrador mantiene el límite de evidencia.", "evidence_ids": ["E-001"]}],
  "analytics": {"state": "not_requested", "reason": "No se solicitó una observación agregada."},
  "market_context": {"state": "not_researched", "reason": "No hay investigación de vacantes fechada."},
  "methodology_source_categories": ["good_profile", "profile_photo", "cover_image", "skills"],
  "privacy": {"private_report": true, "candidate_identity_included": false, "contact_data_included": false, "raw_profile_retained": false, "raw_private_analytics_included": false, "aggregate_analytics_included": false},
  "authorization": {"external_actions_authorized": false, "action_state": "not_executed"}
}
